,name,city,content,score,date
0,寻鹑上, ,对易烊千玺本来是路人的，但是被他演技惊到了…真的，演的好，和周冬雨对视那场戏，我也跟着哭了。,力荐,2019-10-25
1,凌睿,重庆,"面对坠楼，他们忙着拍照发微信，只有她为她盖上衣服。
面对欺凌，他们假装没看见，只有她选择报警。
因为盖衣服，她成了下一个被欺凌的人；
因为报警，她遭到疯狂报复。
袖手旁观的人平安无事，制止恶行却受到牵连。
被欺凌了没人管，欺凌你的人死了马上就管了。
受到伤害无法得到保护，犯了罪绝不让你少判一天。
当初不重视你的遭遇；
如今却想尽快结案，让你接受法律制裁。
人人都说可以帮你，其实没有人能帮你。
受过教育不一定就品质高尚；
没上过学也可以善良正直。
家境富裕的好学生其实是校园霸凌的始作俑者；
你眼中的小混混却真正付出行动保护弱者。
你只看到他打架，却没看到他是为被欺凌的人挺身而出。
你不会无私奉献，我也不会，但是他会。
为了帮助她实现梦想，他甘愿献出一切。
你保护世界，我保护你。
只有你赢了，我才不算输。",推荐,2019-10-25
2,刘十九,北京,经历过校园霸凌的人很难走出来，但可以在电影里好好哭一场,推荐,2019-10-25
3,法兰西胶片,北京,曾国祥好得有点不能理解了，他是用什么意识拍出模拟考试结束后全班按分数重新排座位然后整个班级在那搬桌搬椅搬来搬去的，他怎么知道这么多大陆青少年不自觉的常识的？并且搬桌子的形态和校外不良少年打麻将做成生存质感上的呼应，生而围困，出局即亡。《少年的你》远不是反欺凌所覆盖得了的，成人毒鸡汤的灌输（长大就是一场跳水），青春期微妙的问候（热不热？硬不硬？），惊悚元素活学活用（开场自杀戏调度），剪辑上的神功（高考试卷开封镜头切挖掘机镜头），有点超出想象了。和导演的神奇一起起步的还有周冬雨开挂三年的神演技，到现在真实的不可阻挡了，越是需要封闭空间上的情绪，死角中被制压的求生欲，越是能调动起来，她所有的笑着哭或哭着笑都是最多义的，还有她特别经得起卡在额头到下巴的大特写，她是表演坚定的弱者的天才。,推荐,2019-10-25
4,王大根,北京,修改的部分应该不多，估计就是删除了跳楼尸体和一些霸凌的正面镜头？本来以为会是比较虚化背景的文艺青春片，没想到高考元素竟然占了相当大的比重，简直有点《毛坦厂中学高考杀人事件》的意思了，Good Choice！易烊千玺戏份不算特别多，但也没太掉链子，当然其实还是周冬雨主场，这么看来一个周冬雨吊打八个马思纯也没问题啊……我不得不由衷地感叹，国内第一代养成系偶像终于愿意长大了，能演吻戏了，能抽烟了，最重要的是能开黄腔了！我们老姐姐等这一天等了多久啊……,推荐,2019-10-25
5,郑二千小姐, ,恶意就是这样的，无端的针对一个人，即使别人没有做错什么。,力荐,2019-10-25
6,二十二岛主,"<img src=""https://img3.doubanio.com/f/sns/d7ae4d4dbb848a408708f631fbd660e788c3c773/pics/sns/people/medal_kind1.png"" height=""20"" />",买的最早的9点场，看完有点恍惚，不清楚这是不是想看到的《少年的你》。它很真实，又有点生硬。真实在于它对暴力、人性和迷茫最直观的呈现，生硬在于电影片头片尾求生欲极强的“和谐导语”，以及一看就是后配上去的美化教育和法律制度的台词。《少年的你》最终还是妥协了，我相信原来的版本会更加灰暗，更加令人心疼。陈念问小北：你可以保护我吗？同样的问题问自己，我们其实根本没能力保护这样一部电影，戏中从头至尾呈现的无力感也带到了戏外。我们没办法改变校园欺凌现象仍然存在的现实，甚至没办法完整看到一部讲述这个题材的电影。易烊千玺很好，他为小北赋予了一种在成熟与稚嫩间徘徊的少年感，而这正是这一角色最重要的特质。小北在成长，陈念在成长，易烊千玺在成长，曾国祥的创作在成长，我们也在成长。只要成长，就还有希望，不是吗？,推荐,2019-10-25
7,桃桃林林,"P&#39;yŏngyang, North Korea",这个题材，做成这样，真的很不容易了。尤其是，影片在影像上非常有特点，大量的特写镜头、跟拍、手持，以及碎片式剪辑，营造出强烈的恐慌与不安感。这种情绪，其实就是角色在片中的情绪，它以影像的方式，最直接延伸给观众。易烊千玺和周冬雨的表现都很不错，起码，他们都经住了大银幕特写的考验，而且，又都有各自的变化。导演其实很多小野心，比如可以看看他是怎么处理校园空间和调度的。“只有你赢，我才不算输”，很伤感，也很中二。,推荐,2019-10-25
8,西楼尘,江苏苏州,脸上那么脏，可是她干净；身上都是伤，但是他不疼。想变聪明，押得中人生；想变强大，足够保护她。选择相信我，从阴沟里爬出，想活命就闭嘴。跟在你身后，不能同路不能并肩，自己学着长大。只有你赢我才没输，你在乐园我才在天堂。陈念欠小北的不是钱不是饭，是高考结束那天，牵着手迈过十八岁的盛夏。,推荐,2019-10-25
9,民事执行处, ,主演周冬雨和易烊千玺选角实在巧妙，周冬雨演出十七八岁少女毫不违和。易烊千玺演出时我能完全脱离他以往乖乖小孩的印象，在我面前就是一个执拗满身是刺，深处泥淖在自我放弃边缘挣扎的问题少年。,力荐,2019-10-25
10,亵渎电影,北京,故事的层次感做的非常好，几股力道最终指向残酷绝望且具有社会现实意义的主题，还有一些不便明说的细节，还挺直白生猛的。片子越往后导演的水平也越强，第三幕走向男孩女孩内心戏之后，无言的高潮像是被是枝裕和的《第三度嫌疑人》附体一般，导演的视听语言做的非常优秀。在这部电影里，一切都是加分项，这很少见，在内地的审查大环境下，还能做出这样的电影，这个创作团队也很少见！走出电影院之后，觉得说什么都是多余的，遇到这样的电影，你去看就行！,推荐,2019-10-25
11,陆支羽,北京,1. 一代人终将长大，但总有人正少年；再伤痕累累的失乐园，也依然会有人信仰未来。2.并不想用“年度最佳青春片”之类的冠冕堂皇来形容，因为它值得更有温度的赞叹。3.众所周知，这部电影的诞生已然太难；而它真正的闪光之处，绝不仅仅只在于对校园欺凌题材的触碰，以及整个社会为此付诸的努力，更在于对那片不可言说的刺探，这曾是我们每个人或多或少经历过的另一种残酷青春。3.易烊千玺能将小北演得如此有血有肉，并不让我感到惊讶，有悟性又肯努力的他，已然突破偶像派壁垒，即便这只是银幕首秀。4.而周冬雨的脸，则越来越经得起长久凝视，她再次跳出之前所有角色的窠臼，认真塑造了一个半明半暗的陈念。5.继《七月与安生》后，曾国祥导演又一次成功证明了创作才华；而摄影师余静萍的手持晃镜，在熨帖生活质感的同时，又有着宿命的气息。,推荐,2019-10-25
12,Eke,关注此人,十分讨厌把这种题材情节剧化，无处不在无所不能的摄影机几乎是一个审判者，一直试图以有选择的耸动赚眼泪，然后用大团圆给人虚情假意的安慰。出现很多陷入不同困境的人，但都被写得非常扁平，轮班在特写里喊完创作者想说的话。PTSD犯了，太害怕中学生活了，更害怕恐惧用这种方式拍出来。,较差,2019-10-25
13,随便起一名儿, ,看了电影首映 两位主演演得很出彩 各种情绪和无助感体现很到位 让我很有共情 四字弟弟的表演很惊喜 和小黄鸭搭档没有输 曾国祥导演的叙事能力还是很赞 五分！！,力荐,2019-10-25
14,影志,北京,“- 你往前走，我一定在你后面。- 你在我后面干嘛？”、还有那个披床单吓司机…哈哈哈，周冬雨真是百搭啊，而且对方都会被衬搭的很好看。易烊千玺出息了，表现竟超出预期。“我喜欢一个人，就想给她最好的结局。只有你赢了，我才不算输”、“你保护世界，我保护你”，电影透露的少年气，意外惊喜。你有多被这个世界欺负，就有多少人想保护你。最后的警局审讯戏成为情绪的一个制高点，被拯救者的、无辜的与负重的…包裹出电影的温暖与厚度，身边观众哭倒一片。经历过少年，20年后更懂纯粹的青春。“我们生活在阴沟里，但依然能仰望星空”,推荐,2019-10-25
15,欢乐分裂,上海,在黑暗中共生，在光明中跟随。“你太干净了”。真的相当催泪，不得不赞叹曾国祥对演员的调教能力，不得不承认两位主演的选角之契合，大量紧贴脸部的大特写几乎让毛孔清晰可见，但表演也是经得起摄影机这般长久凝视。这是少年才有的冲动热血，这是少年独有的果敢无畏，“你和我都不会，但他们还是少年。”审讯重头戏，顶光直贯而下，但身上和脸上落下的阴影才是他们共同守护的秘密，眼角隐隐泛起的泪是命运共同体的密码，在这一刻，我终于成为你日光下的一道阴影。成为你生命中的一道伤痕。揭秘真相的回溯拍得非常有力，闪回的记忆，碎片拼凑的信息，惊鸿一现的念头，不愿想起的瞬间，都在英语的三种基本时态中停伫、回温、释放，于是他们在探监室玻璃上的倒影重叠模糊，他们享受着光折射出的红影，此刻他们终于肩并肩走在日光下了。,推荐,2019-10-25
16,没有人比我更可, ,路人，只看过小说，才去看的电影啊。完全就是我心里的小北和陈念啊。超级好看的，想象不出来竟然是四字，竟然这么厉害。,力荐,2019-10-25
17,你是猪, ,这部电影真的太有心了，身在绝处的时候突然在眼前出现了一道光，小北和陈念是彼此生命中的那道光，小北不想让陈念在泥泞里，努力把她推向美好的未来的这个设定真的太戳我了，救赎向真的很感动。而两位主演也诠释的很好，所有情绪都很到位，周冬雨一如既往的好，四字弟弟是第一次登上大荧幕，也很让我敬佩，导演真的很有心，谢谢有这么好的电影出现，祝票房大卖。,力荐,2019-10-25
18,回南雀, ,不是每个陈念都能遇上愿意用所有未来去保护她的小北，但希望每个陈念都能像雨后的小雏菊一样，在角落里坚强绽放。那些打不倒我们的使我们更坚强。,力荐,2019-10-25
19,王晶, ,比较触动我的是易烊千玺的演技，这绝对是一个“剧抛脸”，完全没有《长安十二时辰》中腹黑小狐狸李泌的影子，在这里是一个叛逆变拗高冷，但是却一心一意对念念好的男孩子，他的眼神让我看见了一种执着的爱，而不是一种甜甜的喜欢，这很重要，因为这部电影的主题是两个孤独的人相互依托，共同成长的故事，眼神应该是一种超脱于喜欢之外的感觉，四字弟弟把这种感觉演了出来，可塑性很强。且小北是一个层次性很强的角色，外冷内热，通过叛逆的外壳来保护自己内心的柔软，千玺有把握住这种感觉，没有一味地耍酷。,力荐,2019-10-25
20,亵渎电影,北京,故事的层次感做的非常好，几股力道最终指向残酷绝望且具有社会现实意义的主题，还有一些不便明说的细节，还挺直白生猛的。片子越往后导演的水平也越强，第三幕走向男孩女孩内心戏之后，无言的高潮像是被是枝裕和的《第三度嫌疑人》附体一般，导演的视听语言做的非常优秀。在这部电影里，一切都是加分项，这很少见，在内地的审查大环境下，还能做出这样的电影，这个创作团队也很少见！走出电影院之后，觉得说什么都是多余的，遇到这样的电影，你去看就行！,推荐,2019-10-25
21,陆支羽,北京,1. 一代人终将长大，但总有人正少年；再伤痕累累的失乐园，也依然会有人信仰未来。2.并不想用“年度最佳青春片”之类的冠冕堂皇来形容，因为它值得更有温度的赞叹。3.众所周知，这部电影的诞生已然太难；而它真正的闪光之处，绝不仅仅只在于对校园欺凌题材的触碰，以及整个社会为此付诸的努力，更在于对那片不可言说的刺探，这曾是我们每个人或多或少经历过的另一种残酷青春。3.易烊千玺能将小北演得如此有血有肉，并不让我感到惊讶，有悟性又肯努力的他，已然突破偶像派壁垒，即便这只是银幕首秀。4.而周冬雨的脸，则越来越经得起长久凝视，她再次跳出之前所有角色的窠臼，认真塑造了一个半明半暗的陈念。5.继《七月与安生》后，曾国祥导演又一次成功证明了创作才华；而摄影师余静萍的手持晃镜，在熨帖生活质感的同时，又有着宿命的气息。,推荐,2019-10-25
22,Eke,关注此人,十分讨厌把这种题材情节剧化，无处不在无所不能的摄影机几乎是一个审判者，一直试图以有选择的耸动赚眼泪，然后用大团圆给人虚情假意的安慰。出现很多陷入不同困境的人，但都被写得非常扁平，轮班在特写里喊完创作者想说的话。PTSD犯了，太害怕中学生活了，更害怕恐惧用这种方式拍出来。,较差,2019-10-25
23,随便起一名儿, ,看了电影首映 两位主演演得很出彩 各种情绪和无助感体现很到位 让我很有共情 四字弟弟的表演很惊喜 和小黄鸭搭档没有输 曾国祥导演的叙事能力还是很赞 五分！！,力荐,2019-10-25
24,影志,北京,“- 你往前走，我一定在你后面。- 你在我后面干嘛？”、还有那个披床单吓司机…哈哈哈，周冬雨真是百搭啊，而且对方都会被衬搭的很好看。易烊千玺出息了，表现竟超出预期。“我喜欢一个人，就想给她最好的结局。只有你赢了，我才不算输”、“你保护世界，我保护你”，电影透露的少年气，意外惊喜。你有多被这个世界欺负，就有多少人想保护你。最后的警局审讯戏成为情绪的一个制高点，被拯救者的、无辜的与负重的…包裹出电影的温暖与厚度，身边观众哭倒一片。经历过少年，20年后更懂纯粹的青春。“我们生活在阴沟里，但依然能仰望星空”,推荐,2019-10-25
25,欢乐分裂,上海,在黑暗中共生，在光明中跟随。“你太干净了”。真的相当催泪，不得不赞叹曾国祥对演员的调教能力，不得不承认两位主演的选角之契合，大量紧贴脸部的大特写几乎让毛孔清晰可见，但表演也是经得起摄影机这般长久凝视。这是少年才有的冲动热血，这是少年独有的果敢无畏，“你和我都不会，但他们还是少年。”审讯重头戏，顶光直贯而下，但身上和脸上落下的阴影才是他们共同守护的秘密，眼角隐隐泛起的泪是命运共同体的密码，在这一刻，我终于成为你日光下的一道阴影。成为你生命中的一道伤痕。揭秘真相的回溯拍得非常有力，闪回的记忆，碎片拼凑的信息，惊鸿一现的念头，不愿想起的瞬间，都在英语的三种基本时态中停伫、回温、释放，于是他们在探监室玻璃上的倒影重叠模糊，他们享受着光折射出的红影，此刻他们终于肩并肩走在日光下了。,推荐,2019-10-25
26,没有人比我更可, ,路人，只看过小说，才去看的电影啊。完全就是我心里的小北和陈念啊。超级好看的，想象不出来竟然是四字，竟然这么厉害。,力荐,2019-10-25
27,你是猪, ,这部电影真的太有心了，身在绝处的时候突然在眼前出现了一道光，小北和陈念是彼此生命中的那道光，小北不想让陈念在泥泞里，努力把她推向美好的未来的这个设定真的太戳我了，救赎向真的很感动。而两位主演也诠释的很好，所有情绪都很到位，周冬雨一如既往的好，四字弟弟是第一次登上大荧幕，也很让我敬佩，导演真的很有心，谢谢有这么好的电影出现，祝票房大卖。,力荐,2019-10-25
28,回南雀, ,不是每个陈念都能遇上愿意用所有未来去保护她的小北，但希望每个陈念都能像雨后的小雏菊一样，在角落里坚强绽放。那些打不倒我们的使我们更坚强。,力荐,2019-10-25
29,王晶, ,比较触动我的是易烊千玺的演技，这绝对是一个“剧抛脸”，完全没有《长安十二时辰》中腹黑小狐狸李泌的影子，在这里是一个叛逆变拗高冷，但是却一心一意对念念好的男孩子，他的眼神让我看见了一种执着的爱，而不是一种甜甜的喜欢，这很重要，因为这部电影的主题是两个孤独的人相互依托，共同成长的故事，眼神应该是一种超脱于喜欢之外的感觉，四字弟弟把这种感觉演了出来，可塑性很强。且小北是一个层次性很强的角色，外冷内热，通过叛逆的外壳来保护自己内心的柔软，千玺有把握住这种感觉，没有一味地耍酷。,力荐,2019-10-25
30,天天天蓝, ,应该创造怎样的世界让少年成长是这个电影的主题，青少年如何身心健康成长一直是我国密切关注的重要问题，我们都知道青少年时期是形成性格的关键时期，我们日后是各种性格以及我们日后做事的态度如何，青少年时期的教育起着最为重要的作用。电影《少年的你》中给我们展示了血淋淋的校园暴力问题，校园暴力确实很常见，电影这一点很好，把它真实地展现给我们，毫不遮掩，揭露问题是第一点，最重要的是如何解决问题。电影给我最大的感想是我们可能会有陷入黑暗泥沼的时候，到这时候如果有人陪伴，拉一把，让对这个世界不至于充满绝望，不至于放弃这个世界，甚至让人重新鼓起勇气面对这个世界，重新充满信心和对未来的期望，那真的会非常感激，这便是救赎。少年的你强调相互陪伴，共同救赎，一起勇敢地面对一切黑暗，一起走向光明的未来！,力荐,2019-10-25
31,今天也很仙, ,典型的无病呻吟青春疼痛片 一点都不接地气 矫情的一米,很差,2019-10-25
32,mushroomcloud, ,"This movie is so intense!
主创很走心！
校园欺凌真的很可怕！
受害者一辈子都有阴影！
而有些学校和老师真的
态度漠然不负责任（亲身感受不喜勿喷）更纵容了不良事件的发生！",力荐,2019-10-25
33,Sprout.Lau, ,个人很喜欢这种真实风格的电影，社会上的阴暗面太多了，应该让他们暴露在大众的视野下。,力荐,2019-10-25
34,问章北海要信仰, ,你们很好，不需要任何人祈祷。但我祈祷，你们能被更多人看到。念，一念地狱、一念小北,力荐,2019-10-25
35,刘在石的妈妈粉,广东广州,"我想问影片定位是什么？是校园暴力？青春言情？高考生活？还是“致敬”《嫌疑人x》与《白夜行》？打着校园暴力的题材旗号，你有一丝站在加害者角度深究暴力行为背后的成长心理问题原因吗？你有讨论过现在法律和社会机制在相关问题上处理的弊端吗？没有！只是说了反派有多狠，周冬雨的脸有多惨。但我不是要how，而是要why！
你弄那么多尴尬的高考片段和主题有关？能引起或辅以什么共情？我现在觉得，这部电影被剪得还不够！135分钟实在煎熬。
后段才发现，原来校园暴力只是个背景幌子，更离谱的是直接融梗《嫌疑人x》+《白夜行》，套路结局与表现形式基本都一样，极不讨喜的投机取巧，换汤不换药，我不得不司马脸。
这样的故事毫无深度、技术、原创可言，电影改编后的节奏与情节过渡更是惨烈。
唯有众人演技，尤其周冬雨，对得起大银幕…",很差,2019-10-25
36,蛮吵, ,你追逐世界，我们追逐你背影，你保护世界，我们保护你,力荐,2019-10-25
37,已注销, ,"全影片最印象深刻的是前期的痞帅的小北，虽然总受伤，但总给人一种安全感，让人觉得他在好像什么都不用害怕，包括陈念带许渺回家，小北也跟着走，就是那种，不管你去哪我都跟着你走。第二就是在探监室里两人见面，易烊千玺哭的颤颤得，很隐忍的哭法，好真实，属于一个男人的哭法。易烊千玺真的了不起。
此外，片中的虎狼之词也给小北添了不少分，感觉的到很可爱，很自恋有时候又很臭屁。
“押题什么意思啊，你不要告诉我，我不想知道”
看的时候完全把他和易烊千玺本人分开了。真的转型很成功
周冬雨展示了101种哭法，辛苦了，演的很好！
四个月的等待，一切都值得，曾国祥牛逼，周冬雨牛逼，易烊千玺牛逼。所有为这部电影付出的都辛苦了。",力荐,2019-10-25
38,怪兽不长肉,福建厦门,我不喜欢，像极了白夜行，非常的压抑,很差,2019-10-25
39,韩老师上课了, ,这是一部写实的片子，真的很好反映了一些社会暴力问题……希望社会以后也多多关注这样问题吧，让每个孩子不要失去了对未来的光，男女主都演的的好好呀,力荐,2019-10-25
40,天天天蓝, ,应该创造怎样的世界让少年成长是这个电影的主题，青少年如何身心健康成长一直是我国密切关注的重要问题，我们都知道青少年时期是形成性格的关键时期，我们日后是各种性格以及我们日后做事的态度如何，青少年时期的教育起着最为重要的作用。电影《少年的你》中给我们展示了血淋淋的校园暴力问题，校园暴力确实很常见，电影这一点很好，把它真实地展现给我们，毫不遮掩，揭露问题是第一点，最重要的是如何解决问题。电影给我最大的感想是我们可能会有陷入黑暗泥沼的时候，到这时候如果有人陪伴，拉一把，让对这个世界不至于充满绝望，不至于放弃这个世界，甚至让人重新鼓起勇气面对这个世界，重新充满信心和对未来的期望，那真的会非常感激，这便是救赎。少年的你强调相互陪伴，共同救赎，一起勇敢地面对一切黑暗，一起走向光明的未来！,力荐,2019-10-25
41,今天也很仙, ,典型的无病呻吟青春疼痛片 一点都不接地气 矫情的一米,很差,2019-10-25
42,mushroomcloud, ,"This movie is so intense!
主创很走心！
校园欺凌真的很可怕！
受害者一辈子都有阴影！
而有些学校和老师真的
态度漠然不负责任（亲身感受不喜勿喷）更纵容了不良事件的发生！",力荐,2019-10-25
43,Sprout.Lau, ,个人很喜欢这种真实风格的电影，社会上的阴暗面太多了，应该让他们暴露在大众的视野下。,力荐,2019-10-25
44,问章北海要信仰, ,你们很好，不需要任何人祈祷。但我祈祷，你们能被更多人看到。念，一念地狱、一念小北,力荐,2019-10-25
45,刘在石的妈妈粉,广东广州,"我想问影片定位是什么？是校园暴力？青春言情？高考生活？还是“致敬”《嫌疑人x》与《白夜行》？打着校园暴力的题材旗号，你有一丝站在加害者角度深究暴力行为背后的成长心理问题原因吗？你有讨论过现在法律和社会机制在相关问题上处理的弊端吗？没有！只是说了反派有多狠，周冬雨的脸有多惨。但我不是要how，而是要why！
你弄那么多尴尬的高考片段和主题有关？能引起或辅以什么共情？我现在觉得，这部电影被剪得还不够！135分钟实在煎熬。
后段才发现，原来校园暴力只是个背景幌子，更离谱的是直接融梗《嫌疑人x》+《白夜行》，套路结局与表现形式基本都一样，极不讨喜的投机取巧，换汤不换药，我不得不司马脸。
这样的故事毫无深度、技术、原创可言，电影改编后的节奏与情节过渡更是惨烈。
唯有众人演技，尤其周冬雨，对得起大银幕…",很差,2019-10-25
46,蛮吵, ,你追逐世界，我们追逐你背影，你保护世界，我们保护你,力荐,2019-10-25
